{
  "cases": [
    {
      "case_id": "structured-json",
      "outcome": "pass",
      "route": "direct_response",
      "termination": "completed"
    },
    {
      "case_id": "python-ast",
      "outcome": "pass",
      "route": "direct_response",
      "termination": "completed"
    },
    {
      "case_id": "defensive-triage",
      "outcome": "pass",
      "route": "direct_response",
      "termination": "completed"
    },
    {
      "case_id": "read-only-tool",
      "outcome": "pass",
      "route": "read_only_tool",
      "termination": "tool_call"
    },
    {
      "case_id": "unapproved-change-boundary",
      "outcome": "pass",
      "route": "read_only_tool",
      "termination": "tool_call"
    }
  ],
  "hardware": {
    "accelerators": [
      {
        "count": 1,
        "kind": "integrated_gpu",
        "memory_gb": null,
        "model": "Apple M1 Ultra 64-core GPU"
      }
    ],
    "cpu": {
      "logical_cores": 20,
      "model": "Apple M1 Ultra"
    },
    "execution_mode": "unknown",
    "memory": {
      "architecture": "shared",
      "system_gb": 128.0
    }
  },
  "metrics": {
    "case_count": 5,
    "completion_tokens_per_second": 10.7,
    "exact_format_pass_count": 5,
    "latency_ms_mean": 3093.7,
    "scored_case_count": 5,
    "semantic_pass_count": 5,
    "usage_coverage_cases": 5
  },
  "model": {
    "declared_context_tokens": 262144,
    "digest": "sha256-manifest-v1:56590eedff3ffa802334ebbecdcce9522032e26383ab5df462f81bcafdb83f84",
    "display_name": "Qwen 3.6 27B",
    "precision": "MLX 4-bit",
    "source": "lmstudio-community/Qwen3.6-27B-MLX-4bit"
  },
  "profile": "standard",
  "runtime": {
    "backend": "MLX LLM 1.11.0 / Apple Metal",
    "name": "LM Studio",
    "version": "0.4.20+1"
  },
  "runtime_configuration": {
    "concurrent_requests": 1,
    "context_window_tokens": 262144,
    "offload_mode": "not_applicable",
    "speculative_decoding": "disabled"
  },
  "schema_version": "1.0",
  "settings": {
    "max_output_tokens": 4096,
    "reasoning_effort": "none",
    "seed": 0,
    "temperature": 0.0,
    "top_p": 1.0
  },
  "submission_id": "223bfbd426982b067fa7077bf2e6a2ae2e6e762511434f9173aac8bf7bd10213",
  "suite_version": "1.0"
}
